{
  "$schema": "https://json-schema.org/draft/2020-12/schema",
  "title": "Enchiridion Text Metadata",
  "description": "Schema for metadata.json files in each text directory",
  "type": "object",
  "required": [
    "title",
    "author",
    "year_written",
    "language",
    "original_language",
    "format",
    "filename",
    "topics",
    "era"
  ],
  "properties": {
    "title": {
      "type": "string",
      "description": "Full title of the work"
    },
    "author": {
      "type": "string",
      "description": "Primary author(s), comma-separated if multiple"
    },
    "translator": {
      "type": [
        "string",
        "null"
      ],
      "description": "Translator name, if applicable"
    },
    "year_written": {
      "type": [
        "integer",
        "string"
      ],
      "description": "Year originally written/published. Use string for approximate dates (e.g., '~300 BCE', '1905')"
    },
    "year_translated": {
      "type": [
        "integer",
        "null"
      ],
      "description": "Year of the English translation used, if applicable"
    },
    "language": {
      "type": "string",
      "description": "Language of the text file in the repo",
      "enum": [
        "English",
        "Latin",
        "French",
        "German",
        "Greek",
        "Italian",
        "Arabic"
      ]
    },
    "original_language": {
      "type": "string",
      "description": "Language the work was originally written in"
    },
    "format": {
      "type": "string",
      "description": "File format of the text in the repo",
      "enum": [
        "epub",
        "pdf",
        "txt",
        "html",
        "markdown"
      ]
    },
    "layout": {
      "type": "string",
      "description": "Optional rendering hint for markdown texts. 'verse' preserves single-newline line breaks for poetry, blank verse, and dramatic dialogue. Omit for ordinary prose.",
      "enum": [
        "verse"
      ]
    },
    "collapse": {
      "type": "integer",
      "minimum": 0,
      "description": "How many heading levels render as collapsible sections; anything deeper renders as a heading with its content beneath. Omit to collapse at every level, which is the default and right for most texts. 0 renders the whole work as one continuous scroll (Plato's dialogues, Greek tragedy, Epictetus) — use it only where the text is short enough to parse whole, since a flat section is parsed when its parent opens. 1 collapses only the top division and reads continuously inside it (Shakespeare's acts, Pascal's fragments). This is a RENDERING decision only: sections, slugs, contents entries and ?s= deep links exist at every level regardless, so choosing a scroll never costs addressability.",
      "examples": [0, 1, 2]
    },
    "filename": {
      "type": "string",
      "description": "Filename of the primary text file in this directory"
    },
    "description": {
      "type": "string",
      "description": "One-line description of the work's significance"
    },
    "topics": {
      "type": "array",
      "items": {
        "type": "string"
      },
      "description": "Subject tags for filtering",
      "examples": [
        [
          "mathematics",
          "geometry"
        ],
        [
          "philosophy",
          "epistemology"
        ],
        [
          "physics",
          "quantum-mechanics"
        ],
        [
          "computer-science",
          "algorithms"
        ],
        [
          "literature",
          "drama"
        ],
        [
          "chemistry",
          "atomic-theory"
        ],
        [
          "biology",
          "evolution"
        ],
        [
          "political-thought"
        ],
        [
          "music-theory"
        ],
        [
          "astronomy"
        ],
        [
          "medicine"
        ],
        [
          "engineering"
        ],
        [
          "optics"
        ],
        [
          "probability"
        ],
        [
          "logic"
        ],
        [
          "ethics"
        ],
        [
          "metaphysics"
        ],
        [
          "theology"
        ]
      ]
    },
    "era": {
      "type": "string",
      "description": "Historical period",
      "enum": [
        "ancient-greece",
        "rome-late-antiquity",
        "islamic-golden-age-medieval",
        "renaissance-scientific-revolution",
        "newtonian-enlightenment",
        "nineteenth-century",
        "modern-era-i",
        "modern-era-ii"
      ]
    },
    "prerequisites": {
      "type": "array",
      "items": {
        "type": "string"
      },
      "description": "Directory names of immediate predecessor texts (one layer deep, temporally proximal). Chain rather than accumulate \u2014 e.g., Maxwell \u2192 Einstein special \u2192 Einstein general, not Euclid \u2192 ... \u2192 Einstein."
    },
    "supplements": {
      "type": "array",
      "items": {
        "type": "string"
      },
      "description": "Directory names of supplements that accompany this text. Populated as supplements are authored."
    },
    "ocr_status": {
      "type": "string",
      "description": "Whether the text is ready to read in clean markdown form. needs-review: produced by the processing pipeline and machine-checked, but not yet read against the source by a person.",
      "enum": [
        "complete",
        "needs-cleanup",
        "needs-review",
        "pending",
        "not-applicable"
      ]
    }
  },
  "additionalProperties": false
}
