{
  "title": "On Growth and Form",
  "author": "D'Arcy Wentworth Thompson",
  "translator": null,
  "year_written": 1917,
  "year_translated": null,
  "language": "English",
  "original_language": "English",
  "format": "pdf",
  "filename": "pg55264-images-3.pdf",
  "description": "Mathematical analysis of biological form, exploring how physical forces and geometry shape living organisms",
  "topics": [
    "biology",
    "mathematics",
    "natural-philosophy"
  ],
  "era": "modern-era-i",
  "prerequisites": [
    "darwin-origin-of-species"
  ],
  "ocr_status": "pending"
}
