{
  "title": "The Merchant of Venice",
  "author": "William Shakespeare",
  "translator": null,
  "year_written": 1600,
  "year_translated": null,
  "language": "English",
  "original_language": "English",
  "format": "pdf",
  "filename": "pg12578-images-3.pdf",
  "description": "Comedy of contract, mercy, and the limits of law in a commercial republic",
  "topics": [
    "literature",
    "drama"
  ],
  "era": "renaissance-scientific-revolution",
  "prerequisites": [],
  "ocr_status": "pending"
}
