{
  "title": "The Art of Grammar",
  "author": "Dionysus Thrax",
  "translator": "Thomas Davidson",
  "year_written": "~100 BCE",
  "year_translated": 1874,
  "language": "English",
  "original_language": "Greek",
  "format": "markdown",
  "filename": "dionysus-thrax-art-of-grammar.md",
  "description": "The first known formal treatment of Greek grammar",
  "topics": [
    "grammar",
    "philosophy-of-language"
  ],
  "era": "ancient-greece",
  "prerequisites": [],
  "ocr_status": "complete"
}
