{
  "title": "Principia Mathematica, Vol. 1",
  "author": "Bertrand Russell, Alfred North Whitehead",
  "translator": null,
  "year_written": 1910,
  "year_translated": null,
  "language": "English",
  "original_language": "English",
  "format": "pdf",
  "filename": "pg78050-images-3.pdf",
  "description": "Attempt to derive all mathematics from logical axioms",
  "topics": [
    "mathematics",
    "logic",
    "foundations"
  ],
  "era": "modern-era-i",
  "prerequisites": [],
  "ocr_status": "pending"
}
