{
  "title": "Dred Scott v. Sandford",
  "author": "Supreme Court of the United States",
  "translator": null,
  "year_written": 1857,
  "year_translated": null,
  "language": "English",
  "original_language": "English",
  "format": "pdf",
  "filename": "pg31425-images-3.pdf",
  "description": "Supreme Court decision denying citizenship to African Americans, precipitating the Civil War",
  "topics": [
    "law",
    "civil-rights",
    "political-thought"
  ],
  "era": "nineteenth-century",
  "prerequisites": [],
  "ocr_status": "pending"
}
