{
  "title": "On the Influence of Carbonic Acid in the Air upon the Temperature of the Ground",
  "author": "Svante Arrhenius",
  "translator": null,
  "year_written": 1896,
  "year_translated": null,
  "language": "English",
  "original_language": "English",
  "format": "pdf",
  "filename": "Arrhenius1896_tcm18-173546.pdf",
  "description": "First quantitative prediction of global warming from carbon dioxide emissions",
  "topics": [
    "chemistry",
    "climate-science",
    "physics"
  ],
  "era": "nineteenth-century",
  "prerequisites": [],
  "ocr_status": "pending"
}
