{
  "title": "On the Genealogy of Morals",
  "author": "Friedrich Nietzsche",
  "translator": "Horace B. Samuel",
  "year_written": 1887,
  "year_translated": 1910,
  "language": "English",
  "original_language": "German",
  "format": "pdf",
  "filename": "pg52319-images-3.pdf",
  "description": "Historical investigation into the origins of moral concepts like good, evil, and guilt",
  "topics": [
    "philosophy",
    "ethics"
  ],
  "era": "modern-era-i",
  "prerequisites": [
    "nietzsche-beyond-good-and-evil"
  ],
  "ocr_status": "pending"
}
