{
  "title": "Pragmatism: A New Name for Some Old Ways of Thinking",
  "author": "William James",
  "translator": null,
  "year_written": 1907,
  "year_translated": null,
  "language": "English",
  "original_language": "English",
  "format": "pdf",
  "filename": "pg5116-images-3.pdf",
  "description": "Lectures defining pragmatism as a method for settling philosophical disputes by tracing practical consequences",
  "topics": [
    "philosophy",
    "epistemology"
  ],
  "era": "modern-era-i",
  "prerequisites": []
}
