{
  "title": "Elements of Programming",
  "author": "Alexander Stepanov and Paul McJones",
  "translator": null,
  "year_written": 2009,
  "year_translated": null,
  "language": "English",
  "original_language": "English",
  "format": "pdf",
  "filename": "eop.pdf",
  "description": "A rigorous approach to programming grounded in abstract algebra and deductive reasoning, decomposing algorithms into their mathematical foundations",
  "topics": [
    "computer-science",
    "programming",
    "mathematics",
    "algorithms"
  ],
  "era": "modern-era-ii",
  "prerequisites": [
    "hoare-an-axiomatic-basis-for-computer-programming",
    "djikstra-notes-on-structured-programming"
  ],
  "ocr_status": "pending"
}
