{
  "title": "Philosophy of Right",
  "author": "G.W.F. Hegel",
  "translator": "S.W. Dyde",
  "year_written": 1820,
  "year_translated": 1896,
  "language": "English",
  "original_language": "German",
  "format": "pdf",
  "filename": "cu31924014578979.pdf",
  "description": "Theory of the state, civil society, and ethical life",
  "topics": [
    "philosophy",
    "political-thought",
    "ethics"
  ],
  "era": "modern-era-i",
  "prerequisites": [
    "hegel-philosophy-of-history"
  ],
  "ocr_status": "pending"
}
