{
  "title": "What Is It Like to Be a Bat?",
  "author": "Thomas Nagel",
  "translator": null,
  "year_written": 1974,
  "year_translated": null,
  "language": "English",
  "original_language": "English",
  "format": "pdf",
  "filename": "Nagel_Bat.pdf",
  "description": "Argument that consciousness has an irreducibly subjective character",
  "topics": [
    "philosophy",
    "philosophy-of-mind"
  ],
  "era": "modern-era-ii",
  "prerequisites": [],
  "ocr_status": "pending"
}
