{
  "title": "Nicomachean Ethics",
  "author": "Aristotle",
  "translator": "W.D. Ross",
  "year_written": "~340 BCE",
  "year_translated": 1925,
  "language": "English",
  "original_language": "Greek",
  "format": "markdown",
  "filename": "aristotle-nicomachean-ethics.md",
  "description": "Systematic inquiry into the nature of the good life, virtue, and human flourishing",
  "topics": [
    "philosophy",
    "ethics"
  ],
  "era": "ancient-greece",
  "prerequisites": [],
  "ocr_status": "complete"
}
