{
  "title": "The Picture of Dorian Gray",
  "author": "Oscar Wilde",
  "translator": null,
  "year_written": 1890,
  "year_translated": null,
  "language": "English",
  "original_language": "English",
  "format": "pdf",
  "filename": "pg174-images-3.pdf",
  "description": "Gothic novel exploring aestheticism, moral corruption, and the relationship between art and life",
  "topics": [
    "literature",
    "novel"
  ],
  "era": "nineteenth-century",
  "prerequisites": [],
  "ocr_status": "pending"
}
