{
  "title": "The Wretched of the Earth",
  "author": "Frantz Fanon",
  "translator": "Richard Philcox",
  "year_written": 1961,
  "year_translated": 2004,
  "language": "English",
  "original_language": "English",
  "format": "pdf",
  "filename": "The Wretched Of The Earth.pdf",
  "description": "Seminal work exploring class dynamics, revolution, and the dehumanizing effects of colonization",
  "topics": [
    "sociology",
    "politics",
    "philosophy",
    "psychology"
  ],
  "era": "modern-era-ii",
  "prerequisites": []
}
