{
  "title": "The Holy Bible (King James Version)",
  "author": "Various",
  "translator": "King James Bible Translators",
  "year_written": "~100",
  "year_translated": 1611,
  "language": "English",
  "original_language": "Hebrew, Aramaic, and Greek",
  "format": "pdf",
  "filename": "pg10-images-3.pdf",
  "description": "The foundational text of Western theology and literature, comprising the Old and New Testaments",
  "topics": [
    "theology",
    "literature",
    "philosophy",
    "ethics"
  ],
  "era": "rome-late-antiquity",
  "prerequisites": [],
  "supplements": [],
  "ocr_status": "pending"
}
